1,1,Tailspin Toys (Head Office),Tailspin Toys (Head Office),Novelty Shop,Tailspin Toys,Waldemar Fisar,90410,2013-01-01T00:00:00.0000000,9999-12-31T23:59:59.9999999,2
2,2,"Tailspin Toys (Sylvanite, MT)",Tailspin Toys (Head Office),Novelty Shop,Tailspin Toys,Lorena Cindric,90216,2013-01-01T00:00:00.0000000,9999-12-31T23:59:59.9999999,2
3,3,"Tailspin Toys (Peeples Valley, AZ)",Tailspin Toys (Head Office),Novelty Shop,Tailspin Toys,Bhaargav Rambhatla,90205,2013-01-01T00:00:00.0000000,9999-12-31T23:59:59.9999999,2
4,4,"Tailspin Toys (Medicine Lodge, KS)",Tailspin Toys (Head Office),Novelty Shop,Tailspin Toys,Daniel Roman,90152,2013-01-01T00:00:00.0000000,9999-12-31T23:59:59.9999999,2
5,5,"Tailspin Toys (Gasport, NY)",Tailspin Toys (Head Office),Novelty Shop,Tailspin Toys,Johanna Huiting,90261,2013-01-01T00:00:00.0000000,9999-12-31T23:59:59.9999999,2
6,6,"Tailspin Toys (Jessie, ND)",Tailspin Toys (Head Office),Novelty Shop,Tailspin Toys,Biswajeet Thakur,90298,2013-01-01T00:00:00.0000000,9999-12-31T23:59:59.9999999,2
7,7,"Tailspin Toys (Frankewing, TN)",Tailspin Toys (Head Office),Novelty Shop,Tailspin Toys,Kalidas Nadar,90761,2013-01-01T00:00:00.0000000,9999-12-31T23:59:59.9999999,2
8,8,"Tailspin Toys (Bow Mar, CO)",Tailspin Toys (Head Office),Novelty Shop,Tailspin Toys,Kanti Kotadia,90484,2013-01-01T00:00:00.0000000,9999-12-31T23:59:59.9999999,2
9,9,"Tailspin Toys (Netcong, NJ)",Tailspin Toys (Head Office),Novelty Shop,Tailspin Toys,Sointu Aalto,90129,2013-01-01T00:00:00.0000000,9999-12-31T23:59:59.9999999,2
10,10,"Tailspin Toys (Wimbledon, ND)",Tailspin Toys (Head Office),Novelty Shop,Tailspin Toys,Siddhartha Parkar,90061,2013-01-01T00:00:00.0000000,9999-12-31T23:59:59.9999999,2
11,11,"Tailspin Toys (Devault, PA)",Tailspin Toys (Head Office),Novelty Shop,Tailspin Toys,Elnaz Javan,90185,2013-01-01T00:00:00.0000000,9999-12-31T23:59:59.9999999,2
12,12,"Tailspin Toys (Biscay, MN)",Tailspin Toys (Head Office),Novelty Shop,Tailspin Toys,Heloisa Fernandes,90054,2013-01-01T00:00:00.0000000,9999-12-31T23:59:59.9999999,2
13,13,"Tailspin Toys (Stonefort, IL)",Tailspin Toys (Head Office),Novelty Shop,Tailspin Toys,Razeena Hosseini,90685,2013-01-01T00:00:00.0000000,9999-12-31T23:59:59.9999999,2
14,14,"Tailspin Toys (Long Meadow, MD)",Tailspin Toys (Head Office),Novelty Shop,Tailspin Toys,Tereza Valentova,90633,2013-01-01T00:00:00.0000000,9999-12-31T23:59:59.9999999,2
15,15,"Tailspin Toys (Batson, TX)",Tailspin Toys (Head Office),Novelty Shop,Tailspin Toys,Filips Jaunzems,90631,2013-01-01T00:00:00.0000000,9999-12-31T23:59:59.9999999,2
16,16,"Tailspin Toys (Coney Island, MO)",Tailspin Toys (Head Office),Novelty Shop,Tailspin Toys,Nitin Matondkar,90467,2013-01-01T00:00:00.0000000,9999-12-31T23:59:59.9999999,2
17,17,"Tailspin Toys (East Fultonham, OH)",Tailspin Toys (Head Office),Novelty Shop,Tailspin Toys,Adam Kubat,90416,2013-01-01T00:00:00.0000000,9999-12-31T23:59:59.9999999,2
18,18,"Tailspin Toys (Goffstown, NH)",Tailspin Toys (Head Office),Novelty Shop,Tailspin Toys,Isabelle Vodlan,90321,2013-01-01T00:00:00.0000000,9999-12-31T23:59:59.9999999,2
19,19,"Tailspin Toys (Lemeta, AK)",Tailspin Toys (Head Office),Novelty Shop,Tailspin Toys,Mithun Bhattacharya,90303,2013-01-01T00:00:00.0000000,9999-12-31T23:59:59.9999999,2
20,20,"Tailspin Toys (College Place, WA)",Tailspin Toys (Head Office),Novelty Shop,Tailspin Toys,Nghi Hua,90050,2013-01-01T00:00:00.0000000,9999-12-31T23:59:59.9999999,2
21,21,"Tailspin Toys (Tresckow, PA)",Tailspin Toys (Head Office),Novelty Shop,Tailspin Toys,Duleep Raju,90790,2013-01-01T00:00:00.0000000,9999-12-31T23:59:59.9999999,2
22,22,"Tailspin Toys (Ward Ridge, FL)",Tailspin Toys (Head Office),Novelty Shop,Tailspin Toys,Cristina Longo,90784,2013-01-01T00:00:00.0000000,9999-12-31T23:59:59.9999999,2
23,23,"Tailspin Toys (Ikatan, AK)",Tailspin Toys (Head Office),Novelty Shop,Tailspin Toys,Hang Tang,90019,2013-01-01T00:00:00.0000000,9999-12-31T23:59:59.9999999,2
24,24,"Tailspin Toys (Dundarrach, NC)",Tailspin Toys (Head Office),Novelty Shop,Tailspin Toys,Intira Mookjai,90758,2013-01-01T00:00:00.0000000,9999-12-31T23:59:59.9999999,2
25,25,"Tailspin Toys (Avenal, CA)",Tailspin Toys (Head Office),Novelty Shop,Tailspin Toys,Sulabha Khalsa,90352,2013-01-01T00:00:00.0000000,9999-12-31T23:59:59.9999999,2
26,26,"Tailspin Toys (Hedrick, IA)",Tailspin Toys (Head Office),Novelty Shop,Tailspin Toys,Dhanishta Majji,90331,2013-01-01T00:00:00.0000000,9999-12-31T23:59:59.9999999,2
27,27,"Tailspin Toys (Bowlus, MN)",Tailspin Toys (Head Office),Novelty Shop,Tailspin Toys,Paula Gonzales,90703,2013-01-01T00:00:00.0000000,9999-12-31T23:59:59.9999999,2
28,28,"Tailspin Toys (North Ridge, NY)",Tailspin Toys (Head Office),Novelty Shop,Tailspin Toys,Tatjana Utjesenovic,90024,2013-01-01T00:00:00.0000000,9999-12-31T23:59:59.9999999,2
29,29,"Tailspin Toys (Eulaton, AL)",Tailspin Toys (Head Office),Novelty Shop,Tailspin Toys,Karel Hanak,90571,2013-01-01T00:00:00.0000000,9999-12-31T23:59:59.9999999,2
30,30,"Tailspin Toys (Koontzville, WA)",Tailspin Toys (Head Office),Novelty Shop,Tailspin Toys,Odessa Schneider,90288,2013-01-01T00:00:00.0000000,9999-12-31T23:59:59.9999999,2
31,31,"Tailspin Toys (Lake Stevens, WA)",Tailspin Toys (Head Office),Novelty Shop,Tailspin Toys,Kimberly Pace,90394,2013-01-01T00:00:00.0000000,9999-12-31T23:59:59.9999999,2
32,32,"Tailspin Toys (Maypearl, TX)",Tailspin Toys (Head Office),Novelty Shop,Tailspin Toys,Nikolajs Kalejs,90087,2013-01-01T00:00:00.0000000,9999-12-31T23:59:59.9999999,2
33,33,"Tailspin Toys (Boyden Arbor, SC)",Tailspin Toys (Head Office),Novelty Shop,Tailspin Toys,Haasini Rai,90497,2013-01-01T00:00:00.0000000,9999-12-31T23:59:59.9999999,2
34,34,"Tailspin Toys (Dallardsville, TX)",Tailspin Toys (Head Office),Novelty Shop,Tailspin Toys,Anjali Asthana,90041,2013-01-01T00:00:00.0000000,9999-12-31T23:59:59.9999999,2
35,35,"Tailspin Toys (Slanesville, WV)",Tailspin Toys (Head Office),Novelty Shop,Tailspin Toys,Shah Omidi,90601,2013-01-01T00:00:00.0000000,9999-12-31T23:59:59.9999999,2
36,36,"Tailspin Toys (Ekron, KY)",Tailspin Toys (Head Office),Novelty Shop,Tailspin Toys,Ferhat Celik,90603,2013-01-01T00:00:00.0000000,9999-12-31T23:59:59.9999999,2
37,37,"Tailspin Toys (Kerby, OR)",Tailspin Toys (Head Office),Novelty Shop,Tailspin Toys,Dayarama Kamei,90686,2013-01-01T00:00:00.0000000,9999-12-31T23:59:59.9999999,2
38,38,"Tailspin Toys (Airport Drive, MO)",Tailspin Toys (Head Office),Novelty Shop,Tailspin Toys,Nils Kalnins,90211,2013-01-01T00:00:00.0000000,9999-12-31T23:59:59.9999999,2
195,195,"Tailspin Toys (Lesslie, SC)",Tailspin Toys (Head Office),Novelty Shop,Tailspin Toys,Viollette Monty,90771,2013-01-01T00:00:00.0000000,9999-12-31T23:59:59.9999999,2
196,196,"Tailspin Toys (Howells, NE)",Tailspin Toys (Head Office),Novelty Shop,Tailspin Toys,Alinne Cardoso,90444,2013-01-01T00:00:00.0000000,9999-12-31T23:59:59.9999999,2
197,197,"Tailspin Toys (Magalia, CA)",Tailspin Toys (Head Office),Novelty Shop,Tailspin Toys,Mani Poddar,90226,2013-01-01T00:00:00.0000000,9999-12-31T23:59:59.9999999,2
198,198,"Tailspin Toys (Buell, MO)",Tailspin Toys (Head Office),Novelty Shop,Tailspin Toys,Deakshitulu Mokkapati,90113,2013-01-01T00:00:00.0000000,9999-12-31T23:59:59.9999999,2
199,199,"Tailspin Toys (Antonito, CO)",Tailspin Toys (Head Office),Novelty Shop,Tailspin Toys,Cezar Pavel,90346,2013-01-01T00:00:00.0000000,9999-12-31T23:59:59.9999999,2
200,200,"Tailspin Toys (Tooele, UT)",Tailspin Toys (Head Office),Novelty Shop,Tailspin Toys,Fanni Benko,90100,2013-01-01T00:00:00.0000000,9999-12-31T23:59:59.9999999,2
201,201,"Tailspin Toys (Skyway, WA)",Tailspin Toys (Head Office),Novelty Shop,Tailspin Toys,Brenda Morgan,90588,2013-01-01T00:00:00.0000000,9999-12-31T23:59:59.9999999,2
202,401,Wingtip Toys (Head Office),Wingtip Toys (Head Office),Novelty Shop,Wingtip Toys,Olga Alexandrova,90625,2013-01-01T00:00:00.0000000,9999-12-31T23:59:59.9999999,2
203,402,"Wingtip Toys (Black Lick, PA)",Wingtip Toys (Head Office),Novelty Shop,Wingtip Toys,Maris Baltins,90477,2013-01-01T00:00:00.0000000,9999-12-31T23:59:59.9999999,2
204,403,"Wingtip Toys (Queen Valley, AZ)",Wingtip Toys (Head Office),Novelty Shop,Wingtip Toys,Parsa Reuser,90588,2013-01-01T00:00:00.0000000,9999-12-31T23:59:59.9999999,2
205,404,"Wingtip Toys (Penns Creek, PA)",Wingtip Toys (Head Office),Novelty Shop,Wingtip Toys,Duleep Srivastava,90195,2013-01-01T00:00:00.0000000,9999-12-31T23:59:59.9999999,2
206,405,"Wingtip Toys (Bourbonnais, IL)",Wingtip Toys (Head Office),Novelty Shop,Wingtip Toys,Miran Nikolic,90582,2013-01-01T00:00:00.0000000,9999-12-31T23:59:59.9999999,2
207,406,"Wingtip Toys (Tuscaloosa, AL)",Wingtip Toys (Head Office),Novelty Shop,Wingtip Toys,Calin Bojin,90011,2013-01-01T00:00:00.0000000,9999-12-31T23:59:59.9999999,2
208,407,"Wingtip Toys (Mooringsport, LA)",Wingtip Toys (Head Office),Novelty Shop,Wingtip Toys,Lang Le,90387,2013-01-01T00:00:00.0000000,9999-12-31T23:59:59.9999999,2
209,408,"Wingtip Toys (Rockwall, TX)",Wingtip Toys (Head Office),Novelty Shop,Wingtip Toys,Bhaagyalakshmi Muppavarapu,90500,2013-01-01T00:00:00.0000000,9999-12-31T23:59:59.9999999,2
210,409,"Wingtip Toys (Orick, CA)",Wingtip Toys (Head Office),Novelty Shop,Wingtip Toys,Dimitry Nechita,90329,2013-01-01T00:00:00.0000000,9999-12-31T23:59:59.9999999,2
211,410,"Wingtip Toys (Bernstein, TX)",Wingtip Toys (Head Office),Novelty Shop,Wingtip Toys,Miroslav Kohout,90314,2013-01-01T00:00:00.0000000,9999-12-31T23:59:59.9999999,2
212,411,"Wingtip Toys (Edmund, WI)",Wingtip Toys (Head Office),Novelty Shop,Wingtip Toys,Fransje Mutlu,90777,2013-01-01T00:00:00.0000000,9999-12-31T23:59:59.9999999,2
390,589,"Wingtip Toys (Alcester, SD)",Wingtip Toys (Head Office),Novelty Shop,Wingtip Toys,Deviprasad Prabhupāda,90797,2013-01-01T00:00:00.0000000,9999-12-31T23:59:59.9999999,2
391,590,"Wingtip Toys (McAdenville, NC)",Wingtip Toys (Head Office),Novelty Shop,Wingtip Toys,Aija Lukstina,90644,2013-01-01T00:00:00.0000000,9999-12-31T23:59:59.9999999,2
392,591,"Wingtip Toys (Idaho City, ID)",Wingtip Toys (Head Office),Novelty Shop,Wingtip Toys,Hoc Le,90426,2013-01-01T00:00:00.0000000,9999-12-31T23:59:59.9999999,2
393,592,"Wingtip Toys (Dunkerton, IA)",Wingtip Toys (Head Office),Novelty Shop,Wingtip Toys,Bhairaam Kidambi,90141,2013-01-01T00:00:00.0000000,9999-12-31T23:59:59.9999999,2
394,593,"Wingtip Toys (Cuyamungue, NM)",Wingtip Toys (Head Office),Novelty Shop,Wingtip Toys,Jae-Hwa Shin,90540,2013-01-01T00:00:00.0000000,9999-12-31T23:59:59.9999999,2
395,594,"Wingtip Toys (Marfa, TX)",Wingtip Toys (Head Office),Novelty Shop,Wingtip Toys,Caterina Fallaci,90235,2013-01-01T00:00:00.0000000,9999-12-31T23:59:59.9999999,2
396,595,"Wingtip Toys (Accomac, VA)",Wingtip Toys (Head Office),Novelty Shop,Wingtip Toys,Baanuraekha Voleti,90378,2013-01-01T00:00:00.0000000,9999-12-31T23:59:59.9999999,2
397,596,"Wingtip Toys (Cos Cob, CT)",Wingtip Toys (Head Office),Novelty Shop,Wingtip Toys,Ranjeet Haldar,90675,2013-01-01T00:00:00.0000000,9999-12-31T23:59:59.9999999,2
398,597,"Wingtip Toys (Haycock, AK)",Wingtip Toys (Head Office),Novelty Shop,Wingtip Toys,Bhaamini Kanaparthi,90603,2013-01-01T00:00:00.0000000,9999-12-31T23:59:59.9999999,2
399,598,"Wingtip Toys (Kapa'a, HI)",Wingtip Toys (Head Office),Novelty Shop,Wingtip Toys,Margit Molnar,90796,2013-01-01T00:00:00.0000000,9999-12-31T23:59:59.9999999,2
400,599,"Wingtip Toys (Dickworsham, TX)",Wingtip Toys (Head Office),Novelty Shop,Wingtip Toys,Chandni Jandhyala,90704,2013-01-01T00:00:00.0000000,9999-12-31T23:59:59.9999999,2
401,600,"Wingtip Toys (Caro, MI)",Wingtip Toys (Head Office),Novelty Shop,Wingtip Toys,Ljubomir Nesic,90043,2013-01-01T00:00:00.0000000,9999-12-31T23:59:59.9999999,2
402,601,"Wingtip Toys (Ruthsburg, MD)",Wingtip Toys (Head Office),Novelty Shop,Wingtip Toys,Telma Hermansson,90451,2013-01-01T00:00:00.0000000,9999-12-31T23:59:59.9999999,2
351,550,"Wingtip Toys (Morrison Bluff, AR)",Wingtip Toys (Head Office),Novelty Shop,Wingtip Toys,Gundega Kundzina,90682,2013-01-01T00:00:00.0000000,9999-12-31T23:59:59.9999999,2
352,551,"Wingtip Toys (Huntingburg, IN)",Wingtip Toys (Head Office),Novelty Shop,Wingtip Toys,Parveen Haldar,90434,2013-01-01T00:00:00.0000000,9999-12-31T23:59:59.9999999,2
353,552,"Wingtip Toys (Shay, PA)",Wingtip Toys (Head Office),Novelty Shop,Wingtip Toys,Noel Cartier,90759,2013-01-01T00:00:00.0000000,9999-12-31T23:59:59.9999999,2
354,553,"Wingtip Toys (Helotes, TX)",Wingtip Toys (Head Office),Novelty Shop,Wingtip Toys,Ilgonis Dzenis,90119,2013-01-01T00:00:00.0000000,9999-12-31T23:59:59.9999999,2
355,554,"Wingtip Toys (Hollandsburg, IN)",Wingtip Toys (Head Office),Novelty Shop,Wingtip Toys,Ondrej Tomek,90683,2013-01-01T00:00:00.0000000,9999-12-31T23:59:59.9999999,2
356,555,"Wingtip Toys (Liberty Grove, MD)",Wingtip Toys (Head Office),Novelty Shop,Wingtip Toys,Mohini Kaul,90204,2013-01-01T00:00:00.0000000,9999-12-31T23:59:59.9999999,2
357,556,"Wingtip Toys (Morita, TX)",Wingtip Toys (Head Office),Novelty Shop,Wingtip Toys,Arnab Malakar,90222,2013-01-01T00:00:00.0000000,9999-12-31T23:59:59.9999999,2
358,557,"Wingtip Toys (New Laguna, NM)",Wingtip Toys (Head Office),Novelty Shop,Wingtip Toys,Mary Barney,90761,2013-01-01T00:00:00.0000000,9999-12-31T23:59:59.9999999,2
359,558,"Wingtip Toys (Bourneville, OH)",Wingtip Toys (Head Office),Novelty Shop,Wingtip Toys,Dhaeraemdranaadh Allu,90164,2013-01-01T00:00:00.0000000,9999-12-31T23:59:59.9999999,2
360,559,"Wingtip Toys (Mendoza, TX)",Wingtip Toys (Head Office),Novelty Shop,Wingtip Toys,Paola Greece,90420,2013-01-01T00:00:00.0000000,9999-12-31T23:59:59.9999999,2
361,560,"Wingtip Toys (Palmas del Mar, PR)",Wingtip Toys (Head Office),Novelty Shop,Wingtip Toys,Flora Olofsson,90167,2013-01-01T00:00:00.0000000,9999-12-31T23:59:59.9999999,2
362,561,"Wingtip Toys (Marion Junction, AL)",Wingtip Toys (Head Office),Novelty Shop,Wingtip Toys,Nguyet Bach,90078,2013-01-01T00:00:00.0000000,9999-12-31T23:59:59.9999999,2
363,562,"Wingtip Toys (Ware Shoals, SC)",Wingtip Toys (Head Office),Novelty Shop,Wingtip Toys,Jyoti Karnik,90181,2013-01-01T00:00:00.0000000,9999-12-31T23:59:59.9999999,2
364,563,"Wingtip Toys (Lostine, OR)",Wingtip Toys (Head Office),Novelty Shop,Wingtip Toys,Samuel Almaraz,90287,2013-01-01T00:00:00.0000000,9999-12-31T23:59:59.9999999,2
365,564,"Wingtip Toys (Tilleda, WI)",Wingtip Toys (Head Office),Novelty Shop,Wingtip Toys,Zuzana Kuchtova,90240,2013-01-01T00:00:00.0000000,9999-12-31T23:59:59.9999999,2
366,565,"Wingtip Toys (Wapiti, WY)",Wingtip Toys (Head Office),Novelty Shop,Wingtip Toys,Mark Ruutel,90344,2013-01-01T00:00:00.0000000,9999-12-31T23:59:59.9999999,2
367,566,"Wingtip Toys (Amado, AZ)",Wingtip Toys (Head Office),Novelty Shop,Wingtip Toys,Corneliu Vladu,90107,2013-01-01T00:00:00.0000000,9999-12-31T23:59:59.9999999,2
368,567,"Wingtip Toys (Jeromesville, OH)",Wingtip Toys (Head Office),Novelty Shop,Wingtip Toys,Severins Polis,90184,2013-01-01T00:00:00.0000000,9999-12-31T23:59:59.9999999,2
369,568,"Wingtip Toys (Ovilla, TX)",Wingtip Toys (Head Office),Novelty Shop,Wingtip Toys,Linda Ledezma,90683,2013-01-01T00:00:00.0000000,9999-12-31T23:59:59.9999999,2
370,569,"Wingtip Toys (West Frostproof, FL)",Wingtip Toys (Head Office),Novelty Shop,Wingtip Toys,Halit Gunes,90126,2013-01-01T00:00:00.0000000,9999-12-31T23:59:59.9999999,2
371,570,"Wingtip Toys (Flomaton, AL)",Wingtip Toys (Head Office),Novelty Shop,Wingtip Toys,Vallo Vesik,90134,2013-01-01T00:00:00.0000000,9999-12-31T23:59:59.9999999,2
372,571,"Wingtip Toys (Pawlet, VT)",Wingtip Toys (Head Office),Novelty Shop,Wingtip Toys,Dana Mrazova,90472,2013-01-01T00:00:00.0000000,9999-12-31T23:59:59.9999999,2
373,572,"Wingtip Toys (Trout Run, PA)",Wingtip Toys (Head Office),Novelty Shop,Wingtip Toys,Ema Slosar,90257,2013-01-01T00:00:00.0000000,9999-12-31T23:59:59.9999999,2
374,573,"Wingtip Toys (Marin City, CA)",Wingtip Toys (Head Office),Novelty Shop,Wingtip Toys,Hemchandra Debnath,90449,2013-01-01T00:00:00.0000000,9999-12-31T23:59:59.9999999,2
375,574,"Wingtip Toys (Molalla, OR)",Wingtip Toys (Head Office),Novelty Shop,Wingtip Toys,Monika Valentova,90761,2013-01-01T00:00:00.0000000,9999-12-31T23:59:59.9999999,2
376,575,"Wingtip Toys (Trumansburg, NY)",Wingtip Toys (Head Office),Novelty Shop,Wingtip Toys,Dattaatraeya Tottempudi,90482,2013-01-01T00:00:00.0000000,9999-12-31T23:59:59.9999999,2
273,472,"Wingtip Toys (San Jacinto, CA)",Wingtip Toys (Head Office),Novelty Shop,Wingtip Toys,Slavko Pavlovic,90017,2013-01-01T00:00:00.0000000,9999-12-31T23:59:59.9999999,2
274,473,"Wingtip Toys (Floriston, CA)",Wingtip Toys (Head Office),Novelty Shop,Wingtip Toys,Doru Munteanu,90298,2013-01-01T00:00:00.0000000,9999-12-31T23:59:59.9999999,2
275,474,"Wingtip Toys (Bokeelia, FL)",Wingtip Toys (Head Office),Novelty Shop,Wingtip Toys,Aile Aasmae,90757,2013-01-01T00:00:00.0000000,9999-12-31T23:59:59.9999999,2
276,475,"Wingtip Toys (Cale, AR)",Wingtip Toys (Head Office),Novelty Shop,Wingtip Toys,Ava Edden,90643,2013-01-01T00:00:00.0000000,9999-12-31T23:59:59.9999999,2